strDrink,Ingredients,Measure,strInstructions
Martinez Cocktail,"['Gin', 'Dry Vermouth', 'Triple sec', 'Orange bitters', 'Cherry']","['1 oz ', '1 oz ', '1/4 tsp ', '1 dash ', '1 ']",Stir all ingredients (except cherry) with ice and strain into a cocktail glass. Top with the cherry and serve.
Martini,"['Gin', 'Dry Vermouth', 'Olive']","['1 2/3 oz ', '1/3 oz ', '1 ']","Straight: Pour all ingredients into mixing glass with ice cubes. Stir well. Strain in chilled martini cocktail glass. Squeeze oil from lemon peel onto the drink, or garnish with olive."
Mary Pickford,"['Light rum', 'Pineapple juice', 'Maraschino liqueur', 'Grenadine', 'Maraschino cherry']","['1 1/2 oz ', '1 oz ', '1/2 tsp ', '1/2 tsp ', '1 ']",Shake and strain into a chilled large cocktail glass
Masala Chai,"['Water', 'Tea', 'Ginger', 'Cardamom', 'Cloves', 'Cinnamon', 'Black pepper', 'Sugar', 'Milk']","['2 cups ', '3-4 tsp ', '1 chunk dried ', '3-4 crushed ', '3 ', '1 piece ', '1-2 whole ', ' to taste\n', ' ']",Bring 2 cups of water to boil. Add all the ingredients and boil again for about 15 seconds. Let stand for a minute. Warm milk in a pot. Filter tea into cups. Add milk and sugar. That's IT.
Miami Vice,"['151 proof rum', 'Pina colada mix', 'Daiquiri mix']","['5 oz Bacardi ', 'frozen ', 'frozen ']","First: Mix pina colada with 2.5 oz. of rum with ice(set aside). Second: Mix daiquiri with 2.5 oz. of rum with ice. Third: While frozen, add pina colda mix then daiquiri mix in glass (Making sure they do not get mixed together)."
Microwave Hot Cocoa,"['Sugar', 'Cocoa powder', 'Salt', 'Water', 'Milk', 'Vanilla extract']","['5 tblsp ', '3 tblsp ', '1 dash ', '3 tblsp hot ', '2 cups ', '1/4 tsp ']","Combine sugar, cocoa, salt and hot water in 1-quart micro-proof measuring cup (or coffee mug). Microwave at HIGH (100%) for 1 to 1 1/2 minutes or until boiling. Add milk, sitr and microwave an additonal 1 1/2 to 2 minutes or until hot. Stir in vanilla, blend well."
Midnight Cowboy,"['Bourbon', 'Dark rum', 'Heavy cream']","['2 oz ', '1 oz ', '1/2 oz ']","In a shaker half-filled with ice cubes, combine all of the ingredients. Shake well. Strain into a cocktail glass."
Midnight Manx,"['Kahlua', ""Bailey's irish cream"", 'Goldschlager', 'Heavy cream', 'Coffee']","['1 oz ', '1 oz ', 'dash ', '2 oz ', '2 oz Hazlenut ']","Fill a mixer with ice and add Baileys, Kahlua, Goldshlager, and cream. Shake for 5 seconds and Strain into a double rocks glass filled with ice. Add chilled coffee Stir and enjoy!"
Midnight Mint,"[""Bailey's irish cream"", 'White Creme de Menthe', 'Cream']","['1 oz ', '3/4 oz ', '3/4 oz double ']","If available, rim cocktail (Martini) glass with sugar syrup then dip into chocolate flakes or powder. Add ingredients into shaker with ice. Shake well then strain into cocktail glass."
Mimosa,"['Champagne', 'Orange juice']","['Chilled ', '2 oz ']","Ensure both ingredients are well chilled, then mix into the glass. Serve cold."
Mojito,"['Light rum', 'Lime', 'Sugar', 'Mint', 'Soda water']","['2-3 oz ', 'Juice of 1 ', '2 tsp ', '2-4 ', nan]",Muddle mint leaves with sugar and lime juice. Add a splash of soda water and fill the glass with cracked ice. Pour the rum and top with soda water. Garnish and serve with straw.
Mojito #3,"['Mint', 'Lemon juice', 'Dark rum', 'Club soda', 'Angostura bitters']","['1/2 handful ', '3 cl ', '1/8 L Jamaican ', '1/8 L ', '8 drops ']","Put mint with lemon juice in a glas, mash the mint with a spoon, ice, rum & fill up with club soda. Top it with Angostura."
Monkey Gland,"['Gin', 'Benedictine', 'Orange juice', 'Grenadine']","['2 oz ', '1 tsp ', '1/2 oz ', '1 tsp ']","Shake well over ice cubes in a shaker, strain into a chilled cocktail glass."
Monkey Wrench,"['Light rum', 'Grapefruit juice', 'Bitters']","['1 1/2 oz ', '3 oz ', '1 dash ']",Pour all of the ingredients into an old-fashioned glass almost filled with ice cubes. Stir well.
Moranguito,"['Absinthe', 'Tequila', 'Grenadine']","['2/5 ', '2/5 ', '1/5 ']","first you put rhe absinthe, then put tequila, then put the Granadine syrup."
Moscow Mule,"['Vodka', 'Lime juice', 'Ginger ale']","['2 oz ', '2 oz ', '8 oz ']",Combine vodka and ginger beer in a highball glass filled with ice. Add lime juice. Stir gently. Garnish.
Mother's Milk,"['Goldschlager', 'Butterscotch schnapps', 'Milk']","['1 oz ', '1 oz ', '1 oz ']","Shake over ice, strain. Serves two."
Mudslinger,"['Southern Comfort', 'Orange juice', 'Pepsi Cola']","['750 ml ', '1 L ', '750 ml ']",Add all contents to a large jug or punch bowl. Stir well!
Mulled Wine,"['Water', 'Sugar', 'Cloves', 'Cinnamon', 'Lemon peel', 'Red wine', 'Brandy']","['3 cups ', '1 cup ', '12 ', '2 ', '1 ', '750 ml ', '1/4 cup ']","Simmer 3 cups water with, sugar, cloves, cinnamon sticks, and lemon peel in a stainless steel pot for 10 minutes. Add wine heat to a ""coffee temperature"" (DO NOT BOIL) then add the brandy."
National Aquarium,"['Rum', 'Vodka', 'Gin', 'Blue Curacao', 'Sour mix', 'Lemon-lime soda']","['1/2 oz ', '1/2 oz ', '1/2 oz ', '1/2 oz ', '2 oz ', '1 splash ']",Pour all ingredients into a shaker of ice. Shake well. Serve on the rocks.
Negroni,"['Gin', 'Campari', 'Sweet Vermouth']","['1 oz ', '1 oz ', '1 oz ']","Stir into glass over ice, garnish and serve."
New York Lemonade,"['Absolut Citron', 'Grand Marnier', 'Lemon juice', 'Club soda']","['2 oz ', '1 oz ', '2 oz sweetened ', '1 oz ']",Serve in a chilled cocktail glass. Lemon and sugar the rim. Stir and Strain.
Nuked Hot Chocolate,"['Cocoa powder', 'Sugar', 'Vanilla extract', 'Milk']","['2 tsp ', '1 tsp ', '1/2 tsp ', '12 oz ']","Mix with a bit of milk (1 oz or so) in coffee mug. Nuke mug for about 30-50 seconds. Stir until the heated cocoa dissolves. Fill mug with milk. Nuke for 1-2 minutes, depending on wattage and preferences as to burnt mouth parts."
Nutty Irishman,"[""Bailey's irish cream"", 'Frangelico', 'Milk']","['1 part ', '1 part ', '1 part ']",Serve over ice
Old Fashioned,"['Bourbon', 'Angostura bitters', 'Sugar', 'Water']","['4.5 cL', '2 dashes', '1 cube', 'dash']","Place sugar cube in old fashioned glass and saturate with bitters, add a dash of plain water. Muddle until dissolved.
Fill the glass with ice cubes and add whiskey.

Garnish with orange twist, and a cocktail cherry."
Orange Crush,"['Vodka', 'Triple sec', 'Orange juice']","['1 oz ', '1 oz ', '1 oz ']",Add all ingredients to tumbler-Pour as shot
Orange Push-up,"['Spiced rum', 'Grenadine', 'Orange juice', 'Sour mix']","['1.5 oz ', '0.5 oz ', '4 oz ', '1 splash ']",Combine liquors in a blender. Add a half scoop of ice and blend. Garnish with an orange and cherry flag. So good it will melt in your mouth!!!
Orange Scented Hot Chocolate,"['Milk', 'Chocolate', 'Orange peel', 'Espresso', 'Nutmeg']","['2 cups ', '4 oz chopped bittersweet or semi-sweet ', '3 2-inch strips ', '1/2 tsp instant ', '1/8 tsp ground ']","Combine all ingredients in heavy medium saucepan. Stir over low heat until chocolate melts. Increase heat and bring just to a boil, stirring often. Remove from heat and whisk untily frothy. Return to heat and bring to boil again. Remove from heat, whisk until frothy. Repeat heating and whisking once again. Discard orange peel. (Can be prepared 2 hours ahead. Let stand at room temperature. Before serving, bring just to boil, remove from heat and whisk until frothy.) Pour hot chocolate into coffee mugs. Makes 2 servings."
Orange Whip,"['Orange juice', 'Rum', 'Vodka', 'Cream', 'Ice']","['4 oz ', '1 oz ', '1 oz ', '1 package ', 'Over ']",Pour ingredients over ice and stir.
Oreo Mudslide,"['Vodka', 'Kahlua', ""Bailey's irish cream"", 'Vanilla ice-cream', 'Oreo cookie']","['1 oz ', '1 oz ', '1 oz ', '2 scoops ', '1 ']","Blend Vodka, Kahlua, Bailey's, ice-cream and the Oreo well in a blender. Pour into a large frosted glass. Garnish with whipped cream and a cherry."
Orgasm,"['Creme de Cacao', 'Amaretto', 'Triple sec', 'Vodka', 'Light cream']","['1/2 oz white ', '1/2 oz ', '1/2 oz ', '1/2 oz ', '1 oz ']","Shake all ingredients with ice, strain into a chilled cocktail glass, and serve."
Owen's Grandmother's Revenge,"['Whiskey', 'Beer', 'Lemonade', 'Ice']","['12 oz ', '12 oz ', '12 oz frozen ', '1 cup crushed ']",Add ingredients and mix in blender.
Paradise,"['Gin', 'Apricot Brandy', 'Orange Juice']","['7 parts', '4 parts', '3 parts ']",Shake together over ice. Strain into cocktail glass and serve chilled.
Pina Colada,"['Light rum', 'Coconut milk', 'Pineapple']","['3 oz ', '3 tblsp ', '3 tblsp ']","Mix with crushed ice in blender until smooth. Pour into chilled glass, garnish and serve."
Pineapple Gingerale Smoothie,"['Ginger', 'Pineapple']","['1/4 inch ', '1/2 ']",Throw everything into a blender and liquify.
Pink Gin,"['Bitters', 'Gin']","['3 dashes ', '2 oz ']","Pour the bitters into a wine glass. Swirl the glass to coat the inside with the bitters, shake out the excess. Pour the gin into the glass. Do not add ice."
Pink Lady,"['Gin', 'Grenadine', 'Light cream', 'Egg white']","['1 1/2 oz ', '1 tsp ', '1 tsp ', '1 ']","Shake all ingredients with ice, strain into a cocktail glass, and serve."
Pink Panty Pulldowns,"['Sprite', 'Pink lemonade', 'Vodka']","['1 L ', '2 cups ', '2 cups ']",Shake well
Pink Penocha,"['Everclear', 'Vodka', 'Peach schnapps', 'Orange juice', 'Cranberry juice']","['750 ml ', '1750 ml ', '1750 ml ', '1 gal ', '1 gal ']",mix all ingredients into bowl keep iced stir frequently
Pisco Sour,"['Pisco', 'Lemon juice', 'Sugar', 'Ice']","['2 oz ', '1 oz ', '1-2 tblsp ', nan]","Vigorously shake and strain contents in a cocktail shaker with ice cubes, then pour into glass and garnish with bitters.[1]"
Planter's Punch,"['Dark rum', 'Orgeat syrup', 'Orange juice', 'Pineapple juice']","['1 part ', '1/2 part ', '2 parts ', '1 part ']","Pour all ingredients, except the bitters, into shaker filled with ice. Shake well. Pour into large glass, filled with ice. Add Angostura bitters, ""on top"". Garnish with cocktail cherry and pineapple."
Popped cherry,"['Vodka', 'Cherry liqueur', 'Cranberry juice', 'Orange juice']","['2 oz ', '2 oz ', '4 oz ', '4 oz ']",Served over ice in a tall glass with a popped cherry (can add more popped cherries if in the mood)!
Poppy Cocktail,"['Gin', 'Creme de Cacao']","['1 1/2 oz ', '3/4 oz white ']","Shake ingredients with ice, strain into a cocktail glass, and serve."
Port And Starboard,"['Grenadine', 'Green Creme de Menthe']","['1 tblsp ', '1/2 oz ']","Pour carefully into a pousse-cafe glass, so that creme de menthe floats on grenadine. Serve without mixing."
Port Wine Cocktail,"['Port', 'Brandy']","['2 1/2 oz ', '1/2 tsp ']","Stir ingredients with ice, strain into a cocktail glass, and serve."
Porto flip,"['Brandy', 'Port', 'Egg Yolk']","['3 parts', '9 parts', '2 parts']","Shake ingredients together in a mixer with ice. Strain into glass, garnish and serve."
Quaker's Cocktail,"['Light rum', 'Brandy', 'Lemon', 'Raspberry syrup']","['3/4 oz ', '3/4 oz ', 'Juice of 1/4 ', '2 tsp ']","Shake all ingredients with ice, strain into a cocktail glass, and serve."
Quarter Deck Cocktail,"['Light rum', 'Sherry', 'Lime']","['1 1/2 ', '1/3 oz cream ', 'Juice of 1/2 ']","Stir all ingredients with ice, strain into a cocktail glass, and serve."
Queen Bee,"['Coffee brandy', 'Lime vodka', 'Sherry']","['1 oz ', '1 1/2 oz ', '1/2 oz cream ']","Shake all ingredients with ice, strain into a cocktail glass, and serve."
Queen Elizabeth,"['Dry Vermouth', 'Gin', 'Benedictine']","['1/2 oz ', '1 1/2 oz ', '1 1/2 tsp ']","Stir all ingredients with ice, strain into a cocktail glass, and serve."
Quentin,"['Dark rum', 'Kahlua', 'Light cream', 'Nutmeg']","['1 1/2 oz ', '1/2 oz ', '1 oz ', '1/8 tsp grated ']","In a shaker half-filled with ice cubes, combine the rum, Kahlua, and cream. Shake well. Strain into a cocktail glass and garnish with the nutmeg."
Quick F**K,"['Kahlua', 'Midori melon liqueur', ""Bailey's irish cream""]","['1 part ', '1 part ', '1 part ']","In a shot glass add 1/3 Kahlua first. Then 1/3 Miduri, topping it off with a 1/3 bailey's irish cream"
Quick-sand,"['Black Sambuca', 'Orange juice']","['25 ml ', 'Add 250 ml ']","Simply add the orange juice, quite a quick pour in order to mix the sambucca with the orange juice. The juice MUST have fruit pulp!"
Radioactive Long Island Iced Tea,"['Rum', 'Vodka', 'Tequila', 'Gin', 'Triple sec', 'Chambord raspberry liqueur', 'Midori melon liqueur', 'Malibu rum']","['1 oz ', '1 oz ', '1 oz ', '1 oz ', '1 oz ', '1 oz ', '1 oz ', '1 oz ']",Pour all ingredients over ice in a very tall glass. Sip cautiously.
Radler,"['Beer', '7-Up']","['12 oz ', '12 oz ']","Pour beer into large mug, slowly add the 7-up (or Sprite)."
Red Snapper,"['Crown Royal', 'Amaretto', 'Cranberry juice']","['1 shot ', '1 shot ', '1 shot ']","One shot each, shake n shoot"
Rose,"['Dry Vermouth', 'Gin', 'Apricot brandy', 'Lemon juice', 'Grenadine', 'Powdered sugar']","['1/2 oz ', '1 oz ', '1/2 oz ', '1/2 tsp ', '1 tsp ', nan]","Shake together in a cocktail shaker, then strain into chilled glass. Garnish and serve."
Royal Bitch,"['Frangelico', 'Crown Royal']","['1 part ', '1 part ']",Into a shot glass layer the Crown Royal on top of the Frangelico.
Royal Flush,"['Crown Royal', 'Peach schnapps', 'Chambord raspberry liqueur', 'Cranberry juice']","['1 1/2 oz ', '1 oz ', '1/2 oz ', '1 oz ']",Pour all the ingredients into tumbler over ice. Strain into glass.
Ruby Tuesday,"['Gin', 'Cranberry juice', 'Grenadine']","['2 oz ', '5 oz ', '2 splashes ']",Pour gin and cranberry into a highball filled with ice cubes. Add grenadine and stir.
Rum Cobbler,"['Sugar', 'Club soda', 'Lemon', 'Dark rum', 'Maraschino cherry', 'Orange']","['1 tsp superfine ', '3 oz ', '1 ', '2 oz ', '1 ', '1 ']","In an old-fashioned glass, dissolve the sugar in the club soda. Add crushed ice until the glass is almost full. Add the rum. Stir well. Garnish with the cherry and the orange and lemon slices."
Rum Cooler,"['Rum', 'Lemon-lime soda', 'Lemon']","['2 oz light or dark ', '4 oz ', '1 ']",Pour the rum and soda into a collins glass almost filled with ice cubes. Stir well and garnish with the lemon wedge.
Rum Old-fashioned,"['Light rum', '151 proof rum', 'Powdered sugar', 'Bitters', 'Water', 'Lime peel']","['1 1/2 oz ', '1 tsp ', '1/2 tsp ', '1 dash ', '1 tsp ', 'Twist of ']","Stir powdered sugar, water, and bitters in an old-fashioned glass. When sugar has dissolved add ice cubes and light rum. Add the twist of lime peel, float 151 proof rum on top, and serve."
Rum Punch,"['Rum', 'Ginger ale', 'Fruit punch', 'Orange juice', 'Ice']","['mikey bottle ', 'large bottle ', '355 ml frozen ', '355 ml frozen ', 'crushed ']",Mix all ingredients in a punch bowl and serve.
Rum Runner,"['Malibu rum', 'Blackberry brandy', 'Orange juice', 'Pineapple juice', 'Cranberry juice']","['1 1/2 oz ', '1 oz ', '3-4 oz ', '3-4 oz ', '3-4 oz ']",Mix all ingredients in glass & add ice.
Rum Screwdriver,"['Light rum', 'Orange juice']","['1 1/2 oz ', '5 oz ']","Pour rum into a highball glass over ice cubes. Add orange juice, stir, and serve."
Rum Sour,"['Light rum', 'Lemon juice', 'Sugar', 'Orange', 'Maraschino cherry']","['2 oz ', '1 oz ', '1/2 tsp superfine ', '1 ', '1 ']","In a shaker half-filled with ice cubes, combine the rum, lemon juice, and sugar. Shake well. Strain into a sour glass and garnish with the orange slice and the cherry."
Rum Toddy,"['Rum', 'Powdered sugar', 'Lemon peel', 'Water']","['2 oz light or dark ', '2 tsp ', '1 twist of ', '2 tsp ']",Dissolve powdered sugar in water in an old-fashioned glass. Add rum and one ice cube and stir. Add the twist of lemon peel and serve.
Russian Spring Punch,"['Vodka', 'Creme de Cassis', 'Sugar Syrup', 'Lemon Juice']","['2.5 cl', '1.5 cl', '1 cl', '2.5 cl']","Pour the ingredients into an highball glass, top with Sparkling wine."
Rusty Nail,"['Scotch', 'Drambuie', 'Lemon peel']","['1 1/2 oz ', '1/2 oz ', '1 twist of ']",Pour the Scotch and Drambuie into an old-fashioned glass almost filled with ice cubes. Stir well. Garnish with the lemon twist.
Salty Dog,"['Grapefruit juice', 'Gin', 'Salt']","['5 oz ', '1 1/2 oz ', '1/4 tsp ']","Pour all ingredients over ice cubes in a highball glass. Stir well and serve. (Vodka may be substituted for gin, if preferred.)"
Sazerac,"['Ricard', 'Sugar', 'Peychaud bitters', 'Water', 'Bourbon', 'Lemon peel']","['1 tsp ', '1/2 tsp superfine ', '2 dashes ', '1 tsp ', '2 oz ', '1 twist of ']","Rinse a chilled old-fashioned glass with the absinthe, add crushed ice, and set it aside. Stir the remaining ingredients over ice and set it aside. Discard the ice and any excess absinthe from the prepared glass, and strain the drink into the glass. Add the lemon peel for garnish."
Scooter,"['Brandy', 'Amaretto', 'Light cream']","['1 oz ', '1 oz ', '1 oz ']","Shake all ingredients well with cracked ice, strain into a cocktail glass, and serve."
Scotch Cobbler,"['Scotch', 'Brandy', 'Curacao', 'Orange', 'Mint']","['2 oz ', '4 dashes ', '4 dashes ', '1 slice ', '1 ']","Pour scotch, brandy, and curacao over ice in an old-fashioned glass. Add the orange slice, top with the mint sprig, and serve."
Scotch Sour,"['Scotch', 'Lime', 'Powdered sugar', 'Lemon', 'Cherry']","['1 1/2 oz ', 'Juice of 1/2 ', '1/2 tsp ', '1/2 slice ', '1 ']","Shake scotch, juice of lime, and powdered sugar with ice and strain into a whiskey sour glass. Decorate with 1/2 slice lemon, top with the cherry, and serve."
Scottish Highland Liqueur,"['Johnnie Walker', 'Honey', 'Angelica root', 'Fennel seeds', 'Lemon peel']","['1 fifth ', '1 1/2 cup mild ', '2 tsp dried and chopped ', '1/4 tsp crushed ', '2 2 inch strips ']","Combine all ingreds in aging container. Cover tightly and shake gently several times during the first 24 hrs. After 24 hrs, remove the lemon zest. Cover again and let stand in a cool, dark place for 2 weeks, shaking gently every other day. Strain through a wire sieve to remove the angelica root and fennel. Return to aging container, cover and let stand undisturbed in a cool dark place for 6 months. Siphon or pour clear liqueur into a sterile bottle. The cloudy dregs may be saved for cooking."
Screaming Orgasm,"['Vodka', ""Bailey's irish cream"", 'Kahlua']","['1 oz ', '1 1/2 oz ', '1/2 oz ']","Pour first vodka, then Bailey's, then Kahlua into a cocktail glass over crushed ice. Stir. Caution: use only high quality vodka. Cheap vodka can cause the Bailey's to curdle. Test your brand of vodka by mixing 1 Tsp each of vodka and Bailey's first."
Screwdriver,"['Vodka', 'Orange juice']","['2 oz ', nan]",Mix in a highball glass with ice. Garnish and serve.
Sea breeze,"['Vodka', 'Cranberry juice', 'Grapefruit juice']","['1 1/2 oz ', '4 oz ', '1 oz ']",Build all ingredients in a highball glass filled with ice. Garnish with lime wedge.
Sex on the Beach,"['Vodka', 'Peach schnapps', 'Cranberry juice', 'Grapefruit juice']","['1 oz ', '3/4 oz ', nan, ' ']",Build all ingredients in a highball glass filled with ice. Garnish with orange slice.
Shanghai Cocktail,"['Light rum', 'Anisette', 'Grenadine', 'Lemon']","['1 oz Jamaican ', '1 tsp ', '1/2 tsp ', 'Juice of 1/4 ']","Shake all ingredients with ice, strain into a cocktail glass, and serve."
Shark Attack,"['Lemonade', 'Water', 'Vodka']","['1 can ', '3 cans ', '1 1/2 cup ']",Mix lemonade and water according to instructions on back of can. If the instructions say to add 4 1/3 cans of water do so. Mix into pitcher. Add 1 1/2 cup of Vodka (Absolut). Mix well. Pour into glass of crushed ice. Excellent!
Shot-gun,"['Jim Beam', 'Jack Daniels', 'Wild Turkey']","['1 part ', '1 part ', '1 oz ']",Pour one part Jack Daneils and one part Jim Beam into shot glass then float Wild Turkey on top.
Sidecar,"['Cognac', 'Cointreau', 'Lemon juice']","['2 oz ', '1/2 oz ', '1 oz ']",Pour all ingredients into cocktail shaker filled with ice. Shake well and strain into cocktail glass.
Sidecar Cocktail,"['Brandy', 'Triple sec', 'Lemon']","['1 oz ', '1/2 oz ', 'Juice of 1/4 ']","Shake all ingredients with ice, strain into a cocktail glass, and serve."
Singapore Sling,"['Cherry brandy', 'Grenadine', 'Gin', 'Sweet and sour', 'Carbonated water', 'Cherry']","['1/2 oz ', '1/2 oz ', '1 oz ', '2 oz ', nan, nan]",Pour all ingredients into cocktail shaker filled with ice cubes. Shake well. Strain into highball glass. Garnish with pineapple and cocktail cherry.
Sloe Gin Cocktail,"['Sloe gin', 'Dry Vermouth', 'Orange bitters']","['2 oz ', '1/4 tsp ', '1 dash ']","Stir all ingredients with ice, strain into a cocktail glass, and serve."
Smut,"['Red wine', 'Peach schnapps', 'Pepsi Cola', 'Orange juice']","['1/3 part ', '1 shot ', '1/3 part ', '1/3 part ']",Throw it all together and serve real cold.
Snake Bite (UK),"['Lager', 'Cider']","['1/2 pint ', '1/2 pint sweet or dry ']",Pour ingredients into a pint glass. Drink. Fall over.
Snakebite and Black,"['Lager', 'Cider', 'Blackcurrant squash']","['1/2 pint ', '1/2 pint ', 'A little bit of ']",Put blackcurrant squash in first up to about 1cm in glass. Then add the larger and cider one after another.
Snowball,"['Advocaat', 'Lemonade', 'Lemon', 'Ice']","['1 1/2 oz ', '8-10 oz cold ', '1 slice ', ' cubes\n']",Place one ice cube in the glass and add 1 1/2 oz of Advocaat. Fill up the glass with lemonade and decorate with a slice of lemon. Serve at once.
Sol Y Sombra,"['Brandy', 'Anisette']","['1 1/2 oz ', '1 1/2 oz ']","Shake ingredients with ice, strain into a brandy snifter, and serve. (The English translation of the name of this drink is ""Sun and Shade"", and after sampling this drink, you'll understand why. Thanks, Kirby.)"
Spanish chocolate,"['Milk', 'Chocolate', 'Cinnamon', 'Egg yolk']","['2 cups ', '2 oz sweet ', '1/2 tsp ', '2 beaten ']","Stir the milk with the chocolate and the cinnamon over low heat until the chocolate dissolves. Add the eggs and beat the mixture until it becomes thick, taking care not to boil. Serve in coffee mug."
Spiced Peach Punch,"['Peach nectar', 'Orange juice', 'Brown sugar', 'Cinnamon', 'Cloves', 'Lime juice']","['46 oz ', '20 oz ', '1/2 cup ', '3 3-inch ', '1/2 tsp ', '2 tblsp ']","Combine peach nectar, orange juice and brown sugar in a large saucepan. Tie cinnamon and cloves in a small cheesecloth bag. Drop into saucepan. Heat slowly, stirring constantly, until sugar dissolves. Simmer 10 minutes. Stir in lime juice. Serve in hot mugs."
Spritz,"['Prosecco', 'Campari', 'Soda Water']","['6 cl', '4 cl', 'splash']","Build into glass over ice, garnish and serve."
Stinger,"['Brandy', 'White Creme de Menthe']","['1 1/2 oz ', '1/2 oz ']","Pour in a mixing glass with ice, stir and strain into a cocktail glass. May also be served on rocks in a rocks glass."
Stone Sour,"['Apricot brandy', 'Orange juice', 'Sweet and sour']","['1 oz ', '1 oz ', '1 oz ']","Shake all ingredients with ice, strain into a chilled whiskey sour glass, and serve."
Strawberry Daiquiri,"['Strawberry schnapps', 'Light rum', 'Lime juice', 'Powdered sugar', 'Strawberries']","['1/2 oz ', '1 oz ', '1 oz ', '1 tsp ', '1 oz ']",Pour all ingredients into shaker with ice cubes. Shake well. Strain in chilled cocktail glass.
Strawberry Lemonade,"['Lemon', 'Sugar', 'Strawberries', 'Water']","['Juice of 1 ', '1 tblsp ', '8-10 ripe ', '1 cup ']",Throw everything into a blender and mix until fairly smooth. Serve over ice.
Strawberry Shivers,"['Strawberries', 'Honey', 'Water']","['1 1/2 cup ', '4 tsp ', '1/2 cup ']","Place all ingredients in the blender jar - cover and whiz on medium speed until well blended. Pour in one tall, 2 medium or 3 small glasses and drink up."
Sunny Holiday Punch,"['Pineapple juice', 'Club soda', 'Orange juice', 'Lemon', 'Berries', 'Champagne']","['46 oz chilled ', '28 oz ', '6 oz frozen ', '1 ', '2 cups ', '1 bottle ']",Combine all ingredients in a punch bowl.
Surf City Lifesaver,"['Ouzo', ""Bailey's irish cream"", 'Gin', 'Grand Marnier']","['1 part ', '1 part ', '2 parts ', '1/2 part ']",Lots of ice and soda top up in tall glass with cherry and a grin.
Swedish Coffee,"['Coffee', 'Aquavit', 'Sugar']","['1 cup', '4 cl ', 'By taste ']",Pour the coffee in an ordinary coffee cup. Add the aquavit. Add sugar by taste. Stir and have a nice evening (morning)
Sweet Bananas,"['Milk', 'Banana', 'Honey']","['2 cups ', '1 ', '1 tblsp ']","Place all ingredients in the blender jar - cover and whiz on medium speed until well blended. Pour in one tall, 2 medium or 3 small glasses and drink up."
Talos Coffee,"['Grand Marnier', 'Coffee']","['3 parts ', '1 part ']",Add your GM and then add your coffee.
Tequila Sour,"['Tequila', 'Lemon', 'Powdered sugar', 'Lemon', 'Cherry']","['2 oz ', 'Juice of 1/2 ', '1 tsp ', '1/2 slice ', '1 ']","Shake tequila, juice of lemon, and powdered sugar with ice and strain into a whiskey sour glass. Add the half-slice of lemon, top with the cherry, and serve."
Tequila Sunrise,"['Tequila', 'Orange juice', 'Grenadine']","['2 measures ', nan, nan]","Pour the tequila and orange juice into glass over ice. Add the grenadine, which will sink to the bottom. Stir gently to create the sunrise effect. Garnish and serve."
Tequila Surprise,"['Tequila', 'Tabasco sauce']","['full glass ', 'About 8 drops ']",Fill shot glass with Tequila. Add drops of Tobasco sauce.
Texas Rattlesnake,"['Yukon Jack', 'Cherry brandy', 'Southern Comfort', 'Sweet and sour']","['1 part ', '1/2 part ', '1 part ', '1 splash ']","Mix all ingredients and Shake well. Sweet at first, with a BITE at the end..."
Texas Sling,"['Kahlua', 'Irish cream', 'Amaretto', '151 proof rum', 'Cream']","['1/2 oz ', '1/2 oz ', '1/2 oz ', '1/2 oz Bacardi ', '1 oz ']","Blend with Ice until smooth. Serve in a tulip glass, top with whip cream."
